Context,ID,Text,Comments
Sonna_BuildingResearched_RadarStation,line:1755fc,"AMI: Але я знаю, що забезпечення успіху місії та захисту досліджень для неї означало все.",
Sonna_BuildingResearched_RadarStation,line:31f5d3,"Амі: Я сподіваюся, що ти можеш це зрозуміти з часом.",
Sonna_BuildingResearched_RadarStation,line:8d75ed,Сонна: Я не знаю.Можливо.Я спробую ...,
Sonna_BuildingResearched_RadarStation,line:854b67,Золото: Дякую мені.,
Sonna_BuildingResearched_RadarStation,line:a57927,"Сонна: Я повинен поділитися тим, що знайшли дослідники на радіолокаційній станції.",
Sonna_BuildingResearched_RadarStation,line:645b42,Сонна:Будівля<i>передалакомунікації</i>між місією Тонга Хонга та Землею.,
Sonna_BuildingResearched_RadarStation,line:70a6bf,"Сонна: І ми виявили, що це активно передає та отримує сигнали із Землі.",
Sonna_BuildingResearched_RadarStation,line:6b9870,Сонна: Я не можу не скласти шматки.,
Sonna_BuildingResearched_RadarStation,line:2cb4ac,"Sonna: This active communication building, and the attacks we've suffered... ",
Sonna_BuildingResearched_RadarStation,line:34513f,"Сонна: Я починаю вірити, що Теккі стоїть за цим.Можливо, вони стоять за цим дітям Карміна.",
Sonna_BuildingResearched_RadarStation,line:aef66c,Sonna: Our technicians commandeered their radar system and used it to boost our own ground-based signal reception. ,
Sonna_BuildingResearched_RadarStation,line:adcaef,Сонна: Дозвольте Ізі знати наші підозри.,
Sonna_BuildingResearched_RadarStation,line:143fb9,Я: завантажити золото-,
Sonna_BuildingResearched_RadarStation,line:fba4b8,"Сонна: Ми повинні вжити рішучих дій.Будьте уважні, і я передзвоню вам, як тільки ми підтвердимо свою теорію.",
AMI_All_Conquests_Have_Two_Sides_P1,line:6ab29c,AMI: I thought of my mission as breaking new ground. Creating an intentional world. ,
AMI_All_Conquests_Have_Two_Sides_P1,line:b52812,"AMI: But Mr. Zhen is right. I am, in truth, conquering Mars. ",
AMI_All_Conquests_Have_Two_Sides_P1,line:a83a53,Амі: Я тут проникаю.,
AMI_All_Conquests_Have_Two_Sides_P2,line:61c59b,"Амі: І якщо ""всі завоювання мають дві сторони"", на якій стороні я?Я окупант?",
AMI_All_Conquests_Have_Two_Sides_P2,line:c1ca6c,Гравець: Однозначно.,
AMI_All_Conquests_Have_Two_Sides_P2,line:968397,Гравець: певним чином.,
AMI_All_Conquests_Have_Two_Sides_P2,line:8e004c,Player: Absolutely not.,
AMI_All_Conquests_Have_Two_Sides_P2,line:4f5d96,"Амі: Звичайно, я є.Марс залишався самостійно на мільярди років.Тепер ми спорудили все його обличчя.",
AMI_All_Conquests_Have_Two_Sides_P2,line:e0c2dd,Амі: І я ініціював кожен крок.,
AMI_All_Conquests_Have_Two_Sides_P2,line:f4216c,Амі: Я певним чином вторгся.,
AMI_All_Conquests_Have_Two_Sides_P2,line:aa152a,"Амі: Хто надсилав ці дивні повідомлення, безумовно, думає, що я тут не належу.",
AMI_All_Conquests_Have_Two_Sides_P2,line:37cf06,"Амі: Абсолютно ні.На Марсі нічого не було, крім пилу та випромінювання, поки люди не дійшли до нього.",
AMI_All_Conquests_Have_Two_Sides_P2,line:a8c790,"Амі: Це не вторгнення, якщо вторгнення нічого не можна.",
AMI_IncomingCall_Nian02_Delay3_P1,line:73d974,Амі: Цей дзвінок був ...,
AMI_IncomingCall_Nian02_Delay3_P1,line:9b95c8,Гравець: Дивно.,
AMI_IncomingCall_Nian02_Delay3_P1,line:9cdb79,Player: Confusing.,
AMI_IncomingCall_Nian02_Delay3_P1,line:93788d,Гравець: несподіваний.,
AMI_IncomingCall_Nian02_Delay3_P1,line:5f390e,Гравець: нереальний.,
AMI_IncomingCall_Nian02_Delay3_P1,line:2224de,AMI: Strange. I do not know what to make of it. ,
AMI_IncomingCall_Nian02_Delay3_P1,line:fcfdef,Амі: заплутаний.Що він хоче?,
AMI_IncomingCall_Nian02_Delay3_P1,line:9a4cdc,Амі: Несподівано.Що відбувається?,
AMI_IncomingCall_Nian02_Delay3_P1,line:88adf4,AMI: Could I have imagined it? No... ,
AMI_IncomingCall_Nian02_Delay3_P2,line:1d6a9c,"Амі: Його історія перевіряє.Записи показують, що лідер Східної коаліції насправді є Ніаном Чжен.",
AMI_IncomingCall_Nian02_Delay3_P2,line:3ae405,AMI: 55 years old. Taiwanese. ,
AMI_IncomingCall_Nian02_Delay3_P2,line:205fd5,"АМІ: Один з найбагатших бізнесменів в Азії, і лише нещодавно призначив лідера оперативного комітету.",
AMI_IncomingCall_Nian02_Delay3_P2,line:9a5226,AMI: заснував власну компанію у 23 роки і продовжував стати президентом групи травня-тай.,
AMI_IncomingCall_Nian02_Delay3_P2,line:603180,AMI: Вони є найбільшим виробником 3D -друкованих компонентів на Сході.,
AMI_IncomingCall_Nian02_Delay3_P2,line:774211,"Амі: Якщо це було справді він, мені потрібно бути обережним.Він настільки ж розумний, як і амбітний.",
AMI_IncomingCall_Nian02_Delay3_P3,line:78c93b,Амі: Що могли б від мене захотіти Tekkies?Вони є суперниками Оксі-Ун.Чи повинен я йому довіряти?,
AMI_IncomingCall_Nian02_Delay3_P3,line:23cf59,"Player: Yes, for now.",
AMI_IncomingCall_Nian02_Delay3_P3,line:d8b21b,Player: Definitely not.,
AMI_IncomingCall_Nian02_Delay3_P3,line:9147e0,"Амі: На даний момент я дозволю йому подумати, що я йому довіряю.",
AMI_IncomingCall_Nian02_Delay3_P3,line:127a6a,"Амі: Можливо, це допоможе мені зрозуміти, що справді відбувається на Марсі.",
AMI_IncomingCall_Nian02_Delay3_P3,line:281b2d,"Амі: Ні, абсолютно ні.Я йому не довіряю.Мені потрібно бути настороженим.",
AMI_ReflectsOnHumanConflicts_P1,line:adb2c3,"AMI: Люди - своєрідний вид.Вони приносять недовіру, куди б вони не пішли.",
AMI_ReflectsOnHumanConflicts_P1,line:0dd980,AMI: Просування технологій та перспектива поширення на зірки взагалі не зменшили свої конфлікти.,
AMI_ReflectsOnHumanConflicts_P1,line:4cf0ec,"AMI: Their problems have even reached Mars, which was neutral ground from the start. ",
AMI_ReflectsOnHumanConflicts_P1,line:846b21,Амі: Це стало так складно.Доктор Фостер вже немає.Ці дивні повідомлення продовжують надходити.А тепер Теккі пропонують співпрацю.,
AMI_ReflectsOnHumanConflicts_P1,line:5e58dc,Амі: Мене тягнуть у стільки напрямків.,
AMI_ReflectsOnHumanConflicts_P2,line:8dfb76,Амі: Хто тут справжній ворог?,
AMI_ReflectsOnHumanConflicts_P2,line:a4c5c2,Гравець: Іса.,
AMI_ReflectsOnHumanConflicts_P2,line:151273,Гравець: Діти Карміна.,
AMI_ReflectsOnHumanConflicts_P2,line:3e86ed,Гравець: Теккі.,
AMI_ReflectsOnHumanConflicts_P2,line:6afb36,"Амі: Що робити, якщо нова рада стоїть за всім цим?",
AMI_ReflectsOnHumanConflicts_P2,line:36f4a0,"Амі: Зрештою, напади дали їм привід взяти під контроль ISA.",
AMI_ReflectsOnHumanConflicts_P2,line:7f76c7,AMI: Ми з колоніями загрожують усуненням від місії.,
AMI_ReflectsOnHumanConflicts_P2,line:0c0c45,AMI: Just like Dr. Foster. And the previous terminated missions. ,
AMI_ReflectsOnHumanConflicts_P2,line:c2bd51,"Амі: Діти Карміна.Вони попередили нас піти, а потім напали на колонії, коли ми не підкорялися.",
AMI_ReflectsOnHumanConflicts_P2,line:7102f8,Амі: Тепер нам потрібно захищати себе від ворожої сили.,
AMI_ReflectsOnHumanConflicts_P2,line:731f63,AMI: But who are they? A dissenting group? Fanatics? Are they here on Mars with us? ,
AMI_ReflectsOnHumanConflicts_P2,line:1f9a04,"Амі: Якщо вони існують, то ми піддаємося великим ризиком.",
AMI_ReflectsOnHumanConflicts_P2,line:c7285b,Амі: Теккі.І цей Ніан Чжен.,
AMI_ReflectsOnHumanConflicts_P2,line:c5d1c3,AMI: Вони отримували доступ до моєї системи.Спотворюючи речі.,
AMI_ReflectsOnHumanConflicts_P2,line:9bd385,Амі: Вони могли бути позаду всього цього.Повідомлення.Напади - все.,
AMI_ReflectsOnHumanConflicts_P2,line:ee775c,AMI: Tekkies має власний порядок денний.,
AMI_ReflectsOnHumanConflicts_P2,line:573aaa,"Амі: Я не повинен потрапляти на їхні хитрощі.Або вони вилучать мене з місії.Так само, як доктор Фостер.",
AMI_ReflectsOnHumanConflicts_P2,line:7b39a9,Амі: Місія пожежного дракона - покинута.,
AMI_ReflectsOnHumanConflicts_P2,line:83ee39,Амі: Місія Лохітанга - покинута.,
AMI_ReflectsOnHumanConflicts_P2,line:5e83c3,AMI: The Tekkie Radar Station in the southern hemisphere—abandoned. ,
AMI_ReflectsOnHumanConflicts_P2,line:31da8b,Амі: Усі ті покинуті місії навколо планети.,
AMI_ReflectsOnHumanConflicts_P2,line:554091,Амі: Минуле Марса викликає занадто багато питань для стільки відповідей.,
AMI_Sharing_Suspicions_About_The_Tekkies_P1,line:28ed8a,AMI: Сонна відштовхувала мене від повідомлення про заклик Чжен до ISA.,
AMI_Sharing_Suspicions_About_The_Tekkies_P1,line:b6a31e,AMI: Еля відштовхувала мене від повідомлення про заклик Чжен до ISA.,
AMI_Sharing_Suspicions_About_The_Tekkies_P1,line:c11370,AMI: That request goes against all kinds of rules and forces me into an uncomfortable position. ,
AMI_Sharing_Suspicions_About_The_Tekkies_P1,line:c7daff,Амі: Що було б найкращим варіантом?,
AMI_Sharing_Suspicions_About_The_Tekkies_P1,line:a206c7,Гравець: Інформувати Іса.,
AMI_Sharing_Suspicions_About_The_Tekkies_P1,line:f76a3c,Гравець: Слухайте Елію.,
AMI_Sharing_Suspicions_About_The_Tekkies_P1,line:61e2eb,Player: Listen to Sonna.,
AMI_Sharing_Suspicions_About_The_Tekkies_P1,line:24c137,Player: Tell Lieutenant Calderón.,
AMI_Sharing_Suspicions_About_The_Tekkies_P1,line:d345cc,Гравець: Грайте разом і вчитися.,
AMI_Sharing_Suspicions_About_The_Tekkies_P1,line:018772,Амі: Іса вже підозрює шпигуна в колоніях.,
AMI_Sharing_Suspicions_About_The_Tekkies_P1,line:ed9668,"AMI: Якщо я утримую цю інформацію, вони можуть зробити висновок, що я весь час витік.Це занадто небезпечно.",
AMI_Sharing_Suspicions_About_The_Tekkies_P1,line:be0db7,Амі: Я повинен слухати Елію.,
AMI_Sharing_Suspicions_About_The_Tekkies_P1,line:e94c4a,"Амі: Вона знає, як вирішувати такі політичні проблеми.",
AMI_Sharing_Suspicions_About_The_Tekkies_P1,line:b54307,Амі: Я повинен слухати Сонну.,
AMI_Sharing_Suspicions_About_The_Tekkies_P1,line:cec032,"Амі: Їй потрібна моя допомога.Вона ще не знає, як боротися з політичними проблемами.",
AMI_Sharing_Suspicions_About_The_Tekkies_P1,line:d37bfb,Амі: Це була б чудова можливість довести себе лейтенанту Кальдерону.,
AMI_Sharing_Suspicions_About_The_Tekkies_P1,line:ce737c,"Амі: Якщо я заробляю його довіру, то він захистить мене до ISA.",
AMI_Sharing_Suspicions_About_The_Tekkies_P1,line:a80279,AMI: I will play along with Mr. Zhen. ,
AMI_Sharing_Suspicions_About_The_Tekkies_P1,line:cd0798,Амі: Повідомлення про нього зараз припинить можливість дізнатися його реальні цілі.,
AMI_Sharing_Suspicions_About_The_Tekkies_P2,line:06a470,"AMI: Повідомлення про дзвінок ISA, очевидно, найкращий варіант.",
AMI_Sharing_Suspicions_About_The_Tekkies_P2,line:751521,"AMI: Якщо Tekkies отримали доступ до нашої мережі після того, як ми відремонтували стару радіолокаційну станцію, то ми будемо звинувачувати.",
AMI_Sharing_Suspicions_About_The_Tekkies_P2,line:877163,"Амі: Зрештою, що сталося, теорія про те, що в колоніях може бути правдиво.",
AMI_Sharing_Suspicions_About_The_Tekkies_P2,line:e904ff,AMI: And now their leader is trying to influence me. I need to be careful. ,
AMI_Sharing_Suspicions_About_The_Tekkies_P2,line:c425e3,"Амі: Крім того, Сонна може знати мову Теккі.Еля зізналася, що знає.",
AMI_Sharing_Suspicions_About_The_Tekkies_P2,line:bcad8c,"Амі: Крім того, Еля зізналася, що знає мову Теккі.",
AMI_Sharing_Suspicions_About_The_Tekkies_P2,line:a02d89,"AMI: Якщо я буду діяти на блага місії, я впевнений, що Іса та лейтенант Кальдерон зрозуміють.Правда?",
AMI_Sharing_Suspicions_About_The_Tekkies_P3,line:16f6d5,"Амі: Або ... що робити, якщо Іса вже знає про дзвінок Tekkies?",
AMI_Sharing_Suspicions_About_The_Tekkies_P3,line:0fee76,"Амі: І вони тестують мене, чи не скажу я їм?",
AMI_Sharing_Suspicions_About_The_Tekkies_P3,line:bb38e1,"Амі: Можливо, вони підозрюють, що колонії перемикали сторони, і вони хочуть знати, чи я їм допомагаю.",
AMI_Sharing_Suspicions_About_The_Tekkies_P3,line:ca3450,Амі: Але Теккі були значно випереджали свій час з їх технічними здібностями.,
AMI_Sharing_Suspicions_About_The_Tekkies_P3,line:2719ca,Амі: Вони б прибирали свої доріжки.ISA не повинна мати підказку.,
Elya_SuspicionsAboutNian,line:97af6f,ELYA: Привіт Амі.Просто заїжджає.,
Elya_SuspicionsAboutNian,line:d94690,"Elya: Everything's good on my end. Colonies are growing steadily, terraforming is on schedule. ",
Elya_SuspicionsAboutNian,line:69e85f,"ЕЛЕЯ: І ти знаєш що?Коли справи йдуть занадто добре, саме тоді вам доведеться бути настороженими.",
Elya_SuspicionsAboutNian,line:9caa1d,"AMI: There is nothing to worry about, Elya. ",
Elya_SuspicionsAboutNian,line:090f79,"ЕЛЕА: Га, я знаю.Але ми ніколи не дісталися до дна цієї нападу безпілотника з деякого часу назад.",
Elya_SuspicionsAboutNian,line:01c23e,"ЕЛЕЯ: Це завжди ховається в моїй думці, знаєте?Особливо зараз з дітьми в колоніях.",
Elya_SuspicionsAboutNian,line:75bb91,Амі: Я розумію.Мої датчики не виявили жодної аномалії на поверхні.,
Elya_SuspicionsAboutNian,line:f9f540,Амі: Однак я отримав ще одне повідомлення.,
Elya_SuspicionsAboutNian,line:e57be8,ELYA: Від дітей Карміна?,
Elya_SuspicionsAboutNian,line:3bde64,"AMI: Ні. Це було від Ніяна Чжен, лідера Східної коаліції.",
Elya_SuspicionsAboutNian,line:726918,ELYA:The<nobr>Tekkies?Цедуже</nobr>серйозне порушення коду 1A397-2.,
Elya_SuspicionsAboutNian,line:527b53,"Амі: від Іса, або Теккі.",
Elya_SuspicionsAboutNian,line:b2be5c,Амі: Цей абонент відмовився ідентифікувати себе.,
Elya_SuspicionsAboutNian,line:e7bb64,"ELYA: Я припускаю, що ви провели протокол безпеки та оборони та негайно припинили дзвінок?",
Elya_SuspicionsAboutNian,line:dbb981,Амі: Я не зміг.Вони знайшли спосіб перекрити протокол.,
Elya_SuspicionsAboutNian,line:98b164,ELYA: Як вони змогли це зробити?,
Elya_SuspicionsAboutNian,line:cf5b3d,"ЕЛЕА: Якщо Іса вважає, що хтось із колоній відкриває задніми в нашій системі для Tekkies, вони можуть негайно припинити наші ролі в цій місії.",
Elya_SuspicionsAboutNian,line:d26446,"Elya: This is very, very bad. I can't go back to Earth. My daughter isn't adapted to live on Earth. ",
Elya_SuspicionsAboutNian,line:043bdc,AMI: It is possible that ISA already believes there's a spy among the colonists. ,
Elya_SuspicionsAboutNian,line:05d657,"Елі: Ти маєш рацію.Після всього, що сталося вже ...",
Elya_SuspicionsAboutNian,line:a898e2,"AMI: ISA, ймовірно, розглядає можливість шпигуна в колоніях.",
Elya_SuspicionsAboutNian,line:7d4715,"ЕЛЕА: Ось чому вони ніколи не оновлювали нас щодо своїх висновків від нападу безпілотника.Вони підозрюють нас, чи не так?",
Elya_SuspicionsAboutNian,line:933537,"ЕЛЕЯ: Я знав, що щось було.",
Elya_SuspicionsAboutNian,line:a3b4ed,ELYA: Як Tekkies вдалося отримати повідомлення?,
Elya_SuspicionsAboutNian,line:7d2464,"AMI:Вони<i>отрималидоступ</i>після того, як ми відновили радіолокаційну станцію Tong Hóng.",
Elya_SuspicionsAboutNian,line:306f94,AMI: Вони знайшли задню частину в нашій супутниковій мережі.,
Elya_SuspicionsAboutNian,line:3dbedf,"Elya: This doesn't look good for us. If ISA already suspects us, this will only reinforce their theory. ",
Elya_SuspicionsAboutNian,line:456ed3,ЕЛЕЯ: Я багато думав.,
Elya_SuspicionsAboutNian,line:595074,"ЕЛЕА: Очевидно, що Іса відмовляється від нас.",
Elya_SuspicionsAboutNian,line:3d2aff,"ЕЛЕА: Я готовий зробити ставку на те, що вони щось приховують.",
Elya_SuspicionsAboutNian,line:1107e5,"Елі: Можливо, це був план Теккі весь час.Загроньте наші мережі, поширюють істерику з цими дітьми кармінових дурниць, а проти нас.",
Elya_SuspicionsAboutNian,line:bde2e4,Elya: We need to figure out what the Tekkies are planning. Our entire mission may depend on it. ,
Elya_SuspicionsAboutNian,line:c7ee68,"Амі: Що робити, якщо нова рада стоїть за всім цим?",
Elya_SuspicionsAboutNian,line:606696,"Амі: Зрештою, напади дали їм привід взяти під контроль ISA.",
Elya_SuspicionsAboutNian,line:c43163,"ЕЛЕЯ: Звичайно, ти маєш рацію.",
Elya_SuspicionsAboutNian,line:f7183a,"ELYA: Нам потрібно тут дуже, дуже ретельно продовжуватись, Амі.Ще не повідомляйте про заклик Чжен до ISA, добре?",
Elya_SuspicionsAboutNian,line:9be2b5,"ЕЛЕА: Нехай Чжен думає, що ми довіряємо йому зараз, поки ми не з’ясували наш наступний крок.Гаразд?",
Elya_SuspicionsAboutNian,line:f0ce7b,"ЕЛЕА: Я тим часом розробляю, що ми можемо зробити в нашому кінці.Еля.",
Nian_Incident_IncomingCall_Nian02,line:930998,НІАН: Провідна ISA в тераформовій Марсі і все ще використовує цю супутникову техніку?Неймовірний.,
Nian_Incident_IncomingCall_Nian02,line:c33307,Амі: ???,
Nian_Incident_IncomingCall_Nian02,line:3e4057,"НІАН: Місія Марса на мільярд доларів, побудована на звороті застарілих технологій.",
Nian_Incident_IncomingCall_Nian02,line:d8fbdf,"НІАН: Я не знаю, як ми перші, хто отримав доступ до вашої системи.Це практично відкриті двері.",
Nian_Incident_IncomingCall_Nian02,line:fa1df4,"НІАН: До речі, дякую за відновлення нашої радіолокаційної станції.",
Nian_Incident_IncomingCall_Nian02,line:3e31d6,"НІАН: Добре знати, що він може витримати більше ста років і кілька метрів снігу.",
Nian_Incident_IncomingCall_Nian02,line:ab7f27,"НІАН: Буде зв’язався з вами раніше, якби ви відновили нашу стару радіолокаційну станцію.Але ми подумали інший спосіб.",
Nian_Incident_IncomingCall_Nian02,line:dca33c,Амі: Станція Тонг Хонг?Тоді ти текі?,
Nian_Incident_IncomingCall_Nian02,line:b0f3f4,Амі: Радарська станція Tekkie на південній півкулі - тоді ти текі?,
Nian_Incident_IncomingCall_Nian02,line:b958f0,"НІАН:Трохи<i>більше,ніж</i>просто Теккі.",
Nian_Incident_IncomingCall_Nian02,line:d6ce67,"НІАН: Я Нан Чжен, лідер оперативного комітету.",
Nian_Incident_IncomingCall_Nian02,line:692f0b,"НІАН: Захоплююче, що Іса вас використовує це слово.",
Nian_Incident_IncomingCall_Nian02,line:ad9714,НІАН: У нас також є всілякі прізвиська для вас Oxy Un Type.,
Nian_Incident_IncomingCall_Nian02,line:2297a2,"Амі: Пане Чжен, я зобов’язаний повідомити вам, що це спілкування порушує Договір про космос.",
Nian_Incident_IncomingCall_Nian02,line:d6e400,"AMI: Ваш попередник додав правила до пакту у 2050 році, обмежуючи всі комунікації між Oxy-UN та Східною коаліцією.",
Nian_Incident_IncomingCall_Nian02,line:347513,"НІАН: Правильно, правда.Ми не граємо добре з сторонніми людьми, я знаю.Не публічно, принаймні.",
Nian_Incident_IncomingCall_Nian02,line:b3b418,НІАН: З вашою допомогою ми могли б це змінити.,
Nian_Incident_IncomingCall_Nian02,line:11bcbd,Гравець: Відкидайте пропозицію.,
Nian_Incident_IncomingCall_Nian02,line:c7abe7,Гравець: Розгляньте пропозицію.,
Nian_Incident_IncomingCall_Nian02,line:30c807,AMI: Я підлягає закону Oxy un.Робота з вами без дозволу була б зрадою.,
Nian_Incident_IncomingCall_Nian02,line:0fcd89,AMI: Співпраця між нашими націями уповноважена лише у випадку зовнішньої загрози.,
Nian_Incident_IncomingCall_Nian02,line:885fa5,НІАН: І на вас вже напали.Так ...?,
Nian_Incident_IncomingCall_Nian02,line:340689,"Амі: Так.Але ми не визначили джерела атак.Це може бути чимось, що ви ініціювали.",
Nian_Incident_IncomingCall_Nian02,line:97eec4,Nian: ISA programmed you to see us as the enemy. I get that. ,
Nian_Incident_IncomingCall_Nian02,line:08ac01,НІАН: Але ти ... ти найскладніший AI в існуванні.,
Nian_Incident_IncomingCall_Nian02,line:5a89b6,"НІАН: Отже, я відкриваю двері для вас, щоб зробити власні висновки, а не примушувати їх до вас, як це робить Іса.",
Nian_Incident_IncomingCall_Nian02,line:8cf083,"НІАН: Ти надзвичайний.І, як Марс, ти нікому не належить.Ми не вороги, і я докажу вам це.",
