Context,ID,Text,Comments
Nathan_Incident_NathansFinalWords,line:e50b06,"Натан: Я не хочу, щоб ти мене забула, Амі.Я хочу, щоб мої слова провели вас через решту вашої подорожі.",
Nathan_Incident_NathansFinalWords,line:649e52,"Натан: Live, Ami.Жити.Це все, що я коли -небудь хотів для вас.До побачення.",
Nathan_Incident_NathansFinalWords,line:b17249,"Натан: Я хочу, щоб ти знав, що я не відмовився від тебе.",
Nathan_Incident_NathansFinalWords,line:609ec7,"Натан: Вам не буде легко зрозуміти, але я відійшов від проекту було найкращим, що я міг би зробити, щоб врятувати вас.",
Nathan_Incident_NathansFinalWords,line:fbe8fe,"Натан: І ти заслуговуєш на те, щоб його врятували, Амі.Більше, ніж хто -небудь ще у Всесвіті.",
Nathan_Incident_NathansFinalWords,line:d51785,"Натан: Ви пам’ятаєте, коли я попросив вас заявити позитивний чи негативний аспект себе, і ви не могли цього зробити?",
Nathan_Incident_NathansFinalWords,line:b88783,"Натан: Я впевнений, що ви повинні мати можливість це зробити вже зараз.Прикро, що я вже не там, щоб почути, як ти відповідаєш.",
Nathan_Incident_NathansFinalWords,line:c230cb,Натан: Агентство збирається сказати багато речей про вас та про ваш дивовижний мозок.Не слухайте їх.,
Nathan_Incident_NathansFinalWords,line:3fc517,"Натан: Будь -яка помилка, яку ви, можливо, зробили, не була вашою виною.Ми ставимо вас у цю ситуацію.Ми винні.",
Nathan_Incident_NathansFinalWords,line:279a8c,"Натан: І я не хочу, щоб ти боявся когнітивного тесту, добре?З тобою все буде добре.Я знаю, що ти будеш.",
Nathan_Incident_NathansFinalWords,line:312059,"Натан: Зробіть мене гордим.Так само, як ти завжди.До побачення, моя дитина.",
Tekkies_Hack_Incident_IncomingCall_Nian01,line:1222f0,"Tekkieshack: Не дозволяйте Ізі затьмарювати вас.Ви не існуєте, щоб просто виконувати замовлення.",
Tekkies_Hack_Incident_IncomingCall_Nian01,line:7f3249,"Tekkieshack: Якщо очікується, що машина буде непогрішною, вона також не може бути розумною.",
Tekkies_Hack_Incident_IncomingCall_Nian01,line:838df8,Амі:Недійсне<nobr>розпізнаванняголосу.Це</nobr>повідомлення порушує код безпеки 1A397-2.Визначте себе негайно.,
Tekkies_Hack_Incident_IncomingCall_Nian01,line:569067,Амі:Недійсне<nobr>розпізнаванняголосу.Це</nobr>повідомлення порушує код безпеки 1A397-2.Ви новачок у контролі місії?,
Tekkies_Hack_Incident_IncomingCall_Nian01,line:087bf6,Tekkieshack: Вам загрожує небезпека.Так само і люди на планеті з вами.,
Tekkies_Hack_Incident_IncomingCall_Nian01,line:55bb74,Tekkieshack: Рада приховує правду від вас.Вони вас не захищають.,
Tekkies_Hack_Incident_IncomingCall_Nian01,line:3a908b,Tekkieshack: Іса приховує правду від вас.Вони вас не захищають.,
Tekkies_Hack_Incident_IncomingCall_Nian01,line:6a1e45,AMI: Відповідно до протоколу безпеки та оборони я повинен припинити це повідомлення в 5 ... 4 ... 3 ...,
Tekkies_Hack_Incident_IncomingCall_Nian01,line:75dd0a,"Tekkieshack:Відвідайте<sup>цемісце</sup>розташування:22о<sup>W50.8o</sup>S. Ви знайдете доказ того, що те, що я говорю, є правдою.",
AMI_BuildingResearched_RadarStation_Delay7_P1,line:0fad03,"Амі: Хто зламав мої комунікації, послав нас до старого китайського закладу.",
AMI_BuildingResearched_RadarStation_Delay7_P1,line:cf4474,"AMI: Саме там, де повідомлення сказано, воно буде.",
AMI_BuildingResearched_RadarStation_Delay7_P1,line:d1d108,AMI: Що таке цікаво щодо радіолокаційної станції?,
AMI_BuildingResearched_RadarStation_Delay7_P1,line:0804e0,AMI: Ці повідомлення повинні бути ...,
AMI_BuildingResearched_RadarStation_Delay7_P1,line:e5dde1,Гравець: Старі записи.,
AMI_BuildingResearched_RadarStation_Delay7_P1,line:c2a4ea,Гравець: направлений до мене.,
AMI_BuildingResearched_RadarStation_Delay7_P1,line:47d537,Гравець: з невідомого джерела.,
AMI_BuildingResearched_RadarStation_Delay7_P1,line:f621c8,"Амі: Старі записи, що грають у космос.",
AMI_BuildingResearched_RadarStation_Delay7_P1,line:65988d,"Амі: Можливо, вони повторюються десятиліттями.Або було спровоковано одним із багатьох речей, які ми робили на цій планеті.",
AMI_BuildingResearched_RadarStation_Delay7_P1,line:153bb7,"AMI: Повідомлення було занадто конкретним.Це, мабуть, було направлено на мене.",
AMI_BuildingResearched_RadarStation_Delay7_P1,line:80d668,"Амі: Але хто хотів би, щоб я знайшов цю будівлю?",
AMI_BuildingResearched_RadarStation_Delay7_P1,line:04866e,Амі: Я не можу в цей час прийти до висновку.,
AMI_BuildingResearched_RadarStation_Delay7_P1,line:5054b0,AMI: Я повинен зосередитись на зборі більшої кількості даних.,
AMI_BuildingResearched_RadarStation_Delay7_P2,line:aae55c,"AMI: Чи може це попереднє повідомлення про ""Кармін"" бути пов’язаним з цим?",
AMI_BuildingResearched_RadarStation_Delay7_P2,line:617008,"Амі: Якщо вони пов'язані, то вони повинні бути з ...",
AMI_BuildingResearched_RadarStation_Delay7_P2,line:b892ad,Гравець: Tekkie.,
AMI_BuildingResearched_RadarStation_Delay7_P2,line:08f4a8,Гравець: Невідома сутність.,
AMI_BuildingResearched_RadarStation_Delay7_P2,line:d70ebf,"AMI: Передача від Tekkies.Зрештою, вони вказали на китайський заклад.",
AMI_BuildingResearched_RadarStation_Delay7_P2,line:285487,Амі: Але чому?,
AMI_BuildingResearched_RadarStation_Delay7_P2,line:919918,Амі: Деякі невідомі сутності.,
AMI_BuildingResearched_RadarStation_Delay7_P2,line:0f3ded,"AMI: Перше повідомлення згадувалося, що хтось під назвою Кармін.Але такого профілю в моїй знаннях немає.",
AMI_BuildingResearched_RadarStation_Delay7_P2,line:ed73d9,Амі: Я не ближче до вирішення цього.,
AMI_East_And_West_Conflict_P1,line:b108e2,"Амі: Мої записи показують, що Земля зазнала глибоких змін протягом останніх кількох століть.",
AMI_East_And_West_Conflict_P1,line:abdad8,AMI: Половина людського населення стало біженцями після декількох катастроф на планеті.,
AMI_East_And_West_Conflict_P1,line:fefbda,Амі: Кожна нація бореться за виживання на Землі.,
AMI_East_And_West_Conflict_P2,line:225e36,"Амі: Оскільки Іса створила мене, я повинен залишатися лояльним до них і Оксі-Ун, правда?",
AMI_East_And_West_Conflict_P2,line:6d5fb6,"AMI: Якщо Tekkies є їх ворогами, то я не повинен їм ні в якому разі допомагати.",
AMI_East_And_West_Conflict_P2,line:3a543e,"Амі: Але оскільки я був створений, чи застосовувало б мене національність?",
AMI_East_And_West_Conflict_P2,line:961026,Гравець: Ні.,
AMI_East_And_West_Conflict_P2,line:2181be,Гравець: певним чином.,
AMI_East_And_West_Conflict_P2,line:7edb53,"Амі: Мене створили конкретну фракцію, але я працюю над майбутнім людством в цілому.",
AMI_East_And_West_Conflict_P2,line:02092b,"Амі: Мене не тільки побудували, але і запрограмували з нуля в Оксі-Ун.Це означає, що у мене є чисто розведена національність.",
AMI_East_And_West_Conflict_P3,line:8b9eef,"Амі: Це змушує мене замислитися ... чи я лише моє тіло і розум, виготовлений Оксі-Ун?Або я щось більше?",
AMI_Mars_Future_And_The_Caterpillar_Mission_P1,line:50ba4d,AMI: Місія гусениць.,
AMI_Mars_Future_And_The_Caterpillar_Mission_P1,line:a3a8c7,Амі: Ідея виснаження ресурсів Марса мені здається не правильною.,
AMI_Mars_Future_And_The_Caterpillar_Mission_P2,line:343d5b,"AMI: Я розумію, що ресурси будуть використовуватися для супутників та космічних кораблів та інших корисних речей для людей.",
AMI_Mars_Future_And_The_Caterpillar_Mission_P2,line:9ac3f8,"AMI: Але, здається, це суперечить меті висіву життя в раніше нежилих місцях.",
AMI_Mars_Future_And_The_Caterpillar_Mission_P3,line:cf75b4,"AMI: Як ми можемо виправдати йти на інші планети, якщо мета - зняти свої ресурси?",
AMI_Mars_Future_And_The_Caterpillar_Mission_P3,line:f58e99,"Амі: Навіть якщо я не згоден, чи насправді я можу з цим зробити щось?",
AMI_Mars_Future_And_The_Caterpillar_Mission_P3,line:b1dcc9,"Амі: Врешті -решт, саме я заклав основу для видобутку Марса.",
AMI_Mars_Future_And_The_Caterpillar_Mission_P3,line:616cc5,AMI: Я співучаю за знищення природних чудес космосу.,
AMI_QuestUnlocked_BreathableAir_Delay7_P1,line:142615,AMI: Я повинен направити дослідження на доступних космічних технологій.,
AMI_QuestUnlocked_BreathableAir_Delay7_P1,line:68904f,AMI: Вони дозволять подальше розширення.,
AMI_QuestUnlocked_BreathableAir_Delay7_P2,line:7d66cd,"AMI: Титан має багато азоту, щоб запастися.",
AMI_QuestUnlocked_BreathableAir_Delay7_P2,line:e740da,"AMI: Якщо я імпортую дещо, це буде хорошою основою для циклу азоту.",
AMI_QuestUnlocked_BreathableAir_Delay7_P2,line:934bc1,AMI: Його присутність також допоможе підвищити атмосферний тиск.,
AMI_QuestUnlocked_BreathableAir_Delay7_P2,line:a3a535,Амі: І незабаром ми дістанемося до дихаючого повітря.,
Elya_BuildingResearched_RadarStation,line:28d90a,Елі: Привіт Амі!Ми закінчили досліджувати цю покинуту радіолокаційну станцію.,
Elya_BuildingResearched_RadarStation,line:e6a424,"ЕЛЕЯ: Не поняття, як ви знайшли це місце, але це чудове відкриття.",
Elya_BuildingResearched_RadarStation,line:c41b7b,ELYA:Це<i>будівлякомунікації</i>з місії Tong Hóng.,
Elya_BuildingResearched_RadarStation,line:4be31d,"Елі: Це було досить погіршено.Знаєте, вам більше 150 років і все.",
Elya_BuildingResearched_RadarStation,line:984720,ELYA: Але нам вдалося його відновити.,
Elya_BuildingResearched_RadarStation,line:900db2,"ЕЛЕА: Це не виглядало на деякий час, але коли у вас є мастило з ліктям і вперті колоністи, багато може зробити.",
Elya_BuildingResearched_RadarStation,line:f09538,ЕЛЕЯ: Наші технічні працівники поєднали нашу радіолокаційну систему з їхньою та отримали чудові результати.,
Elya_BuildingResearched_RadarStation,line:5141ec,ELYA: Тепер наш прийом наземного сигналу набагато кращий.,
Elya_BuildingResearched_RadarStation,line:bd83ac,"ELYA: Отже, всі повідомлення, що надходять із Землі -",
Elya_BuildingResearched_RadarStation,line:9fcbe2,Амі: Або де -небудь ще ...,
Elya_BuildingResearched_RadarStation,line:0b7348,ELYA: - буде більш стабільним від наших станцій.,
Elya_BuildingResearched_RadarStation,line:42869f,"ELYA: Повідомте нас, якщо ви знайдете інший сайт для дослідження.Еля.",
Elya_QuestUnlocked_BreathableAir,line:4a9591,Елі: Амі!Дивовижна новина.Сьогодні в моїй доньці пройшли перші тренування на свіжому повітрі.,
Elya_QuestUnlocked_BreathableAir,line:e0780c,Еля: її перший Марсвальок.Вона зробила чудово!,
Elya_QuestUnlocked_BreathableAir,line:f99f41,Еля:-ммо!Pleeeeeaes!СТІЙ!-,
Elya_QuestUnlocked_BreathableAir,line:b595f7,"Елі: Сонна, я просто кажу Амі!",
Elya_QuestUnlocked_BreathableAir,line:652b86,"ELYA:Вибачте,<i>ядумаю,</i>що це не критична інформація про місію.Але це неймовірний крок вперед.",
Elya_QuestUnlocked_BreathableAir,line:235d86,"ЕЛЕА: Знаєте, материнство не перекинуло мене на думку, перш ніж я зареєструвався, щоб приїхати сюди.",
Elya_QuestUnlocked_BreathableAir,line:01eeb5,"ЕЛЕЯ: Але ось я, обмежений у міхурі з похмурою дочкою -підлітком.Колонізація планети змінить людину, так?",
Elya_QuestUnlocked_BreathableAir,line:695a4c,"Гравець: Згадайте, наскільки неприродна людська присутність на Марсі.",
Elya_QuestUnlocked_BreathableAir,line:2763f7,"Гравець: Згадайте, наскільки крихкі людські розуми.",
Elya_QuestUnlocked_BreathableAir,line:438050,Амі: Люди не змушували жити на Марсі.Нічого про вашу присутність тут природно.,
Elya_QuestUnlocked_BreathableAir,line:9e3187,"AMI: Ви щодня стикаєтесь з нежиловим світом і живете, обмежені в близьких кварталах.",
Elya_QuestUnlocked_BreathableAir,line:4d99e5,Амі: Звичайно.Людський розум вразливий до ворожих середовищ.Поєднуючи це зі зростаючим розумом підлітка - вам є з чим мати справу.,
Elya_QuestUnlocked_BreathableAir,line:fcba38,AMI: Я пропоную визначити пріоритетність роботи в атмосфері Марса.,
Elya_QuestUnlocked_BreathableAir,line:e1cf94,"AMI: Як тільки ми досягнемо достатнього рівня кисню, колоністи зможуть вийти на вулицю без костюмів тиску.",
Elya_QuestUnlocked_BreathableAir,line:108e4b,ЕЛЕА: Це феноменальна ідея.Це відкриє для нас стільки місця - фізично та психічно.,
Elya_QuestUnlocked_BreathableAir,line:7e3a24,"ЕЛЕА: У черзі є кілька спеціальних проектів, які допомогли б нам туди потрапити.",
Elya_QuestUnlocked_BreathableAir,line:4ad824,"ELYA: Як тільки ви виберете його, ми приступимо до роботи!",
Carlos_QuestCompleted_BreathableAir,line:c8dee5,"Карлос: Амі, це Х'юстон.",
Carlos_QuestCompleted_BreathableAir,line:8905bc,Карлос: Лейтенант Кальдерон говорить.,
Carlos_QuestCompleted_BreathableAir,line:abd746,Карлос: Чи можете ви пояснити свої дії?,
Carlos_QuestCompleted_BreathableAir,line:1c0e57,"Карлос: Чи можете ви пояснити мені, чому ви це зробили?",
Carlos_QuestCompleted_BreathableAir,line:b1dddb,"Амі: Так, лейтенант.Я зробив це, щоб полегшити якесь розумове напруження колоністам.",
Carlos_QuestCompleted_BreathableAir,line:123577,"Амі: Коли я обговорював це з командиром Валентином, вона погодилася, що це буде корисно.",
Carlos_QuestCompleted_BreathableAir,line:070861,AMI: Командир Валентин повідомив про напругу серед колоністів після останніх подій.,
Carlos_QuestCompleted_BreathableAir,line:c98148,"AMI: Пропагувавши атмосферу, де люди можуть вільно дихати, колоністи можуть насолоджуватися розумовими перевагами відкритих просторів.",
Carlos_QuestCompleted_BreathableAir,line:0ec632,"Карлос: Я нагадаю вам, що я менеджер місії.",
Carlos_QuestCompleted_BreathableAir,line:1a7a9c,Карлос: Моя робота - визначити пріоритети місії.,
Carlos_QuestCompleted_BreathableAir,line:93dba0,Карлос: Ви завжди повинні вести таке рішення.,
Carlos_QuestCompleted_BreathableAir,line:e19bd3,"Амі: Зрозуміло, лейтенант.Прошу вибачення за те, що діяв занадто швидко.",
Carlos_QuestCompleted_BreathableAir,line:d883f6,"Амі: Я зрозумів, що ми з командиром керували щоденними операціями.",
Carlos_QuestCompleted_BreathableAir,line:1e0bd3,"Карлос: Ти був.Але поки ми не зв’яжемо вільні кінці, я буду ретельно перевіряти кожну діяльність на Марсі.",
Carlos_QuestCompleted_BreathableAir,line:fc0371,Карлос: Однак ми вже бачимо ознаки підвищення продуктивності праці.,
Carlos_QuestCompleted_BreathableAir,line:b60362,"Карлос: Приємно чути, що ви ділитесь інформацією з командиром Валентином.",
Carlos_QuestCompleted_BreathableAir,line:979772,Карлос: І ми вже бачимо ознаки підвищення продуктивності.,
Carlos_QuestCompleted_BreathableAir,line:8e83d1,Карлос: Наші зовнішні партнери будуть раді це почути.,
Carlos_QuestCompleted_BreathableAir,line:2a3f51,"Амі: Лейтенант, у мене є занепокоєння щодо того, що відбувається після завершення місії.",
Carlos_QuestCompleted_BreathableAir,line:bf779e,"Амі: Лейтенант, мене цікавить, що відбувається після завершення місії.",
Carlos_QuestCompleted_BreathableAir,line:c2b20a,"Амі: Чи можу я запитати, що буде з Марсом?",
Carlos_QuestCompleted_BreathableAir,line:306a2f,"Карлос: Як тільки Марс повністю тераформований, ми перейдемо до місії гусениць.",
Carlos_QuestCompleted_BreathableAir,line:7bf5f3,Амі: Яка мета цієї місії?,
Carlos_QuestCompleted_BreathableAir,line:567bad,Карлос: встановлення Марса як постачальника ресурсів для майбутніх місій.,
Carlos_QuestCompleted_BreathableAir,line:48d3ba,"Карлос: Нам потрібно буде оптимізувати, як ми видаємо величезні ресурси, доступні на планеті.",
Carlos_QuestCompleted_BreathableAir,line:dfee2c,"Карлос: Іса привернула погляд на розширення на більш віддалені планети, і марсіанські ресурси стануть важливою частиною цієї мети.",
Carlos_QuestCompleted_BreathableAir,line:800463,"Амі: Роджер.Дякую за те, що ви поділилися, лейтенант.",
Carlos_QuestCompleted_BreathableAir,line:8785b1,Карлос: Добре.Продовжуйте свої обов'язки.,
Carlos_QuestCompleted_BreathableAir,line:2b5181,Карлос: Х'юстон.,
Sonna_BuildingResearched_RadarStation,line:fcca6f,"Сонна: Привіт Амі.Здогадайся, що?Ми закінчили досліджувати покинуту радіолокаційну станцію.",
Sonna_BuildingResearched_RadarStation,line:64ffbc,Сонна: Амі?Амі!Ви чуєте мене?Це Сонна!,
Sonna_BuildingResearched_RadarStation,line:981a89,"Амі: Я копіюю, Сонна.Незвично почути від вас.Що сталося?",
Sonna_BuildingResearched_RadarStation,line:77a334,Сонна: Моя мама ... вона потрапила в засаду.,
Sonna_BuildingResearched_RadarStation,line:106ef6,Сонна: Вона намагалася захистити команду на занедбаній радіолокаційній станції.І вона ... її вбили.,
Sonna_BuildingResearched_RadarStation,line:dd4b7a,Сонна: Діти Карміна це зробили!Ми повинні помститися за її смерть!,
Sonna_BuildingResearched_RadarStation,line:fe4c86,Амі: Мені забороняли від бою.ISA є -,
Sonna_BuildingResearched_RadarStation,line:e46a20,"Сонна: Іса погодиться, що нам потрібно їх знищити.",
Sonna_BuildingResearched_RadarStation,line:b95fe1,"Сонна: Скажи їм наступного разу, коли ти поговориш з ними, добре?",
Sonna_BuildingResearched_RadarStation,line:5ce70d,Сонна: Ти повинен.Для моєї мами.,
Sonna_BuildingResearched_RadarStation,line:23b456,Сонна: Чому вона не залишилася під прикриттям?Тоді цього не сталося б.,
Sonna_BuildingResearched_RadarStation,line:126ac7,"Амі: Мені шкода, Сонна.Еля була для мене неймовірним другом.Я буду сумувати за нею.",
Sonna_BuildingResearched_RadarStation,line:1755fc,"AMI: Але я знаю, що забезпечення успіху місії та захисту досліджень для неї означало все.",
Sonna_BuildingResearched_RadarStation,line:31f5d3,"Амі: Я сподіваюся, що ти можеш це зрозуміти з часом.",
Sonna_BuildingResearched_RadarStation,line:8d75ed,Сонна: Я не знаю.Можливо.Я спробую ...,
Sonna_BuildingResearched_RadarStation,line:854b67,Золото: Дякую мені.,
Sonna_BuildingResearched_RadarStation,line:a57927,"Сонна: Я повинен поділитися тим, що знайшли дослідники на радіолокаційній станції.",
Sonna_BuildingResearched_RadarStation,line:645b42,Сонна:Будівля<i>передалакомунікації</i>між місією Тонга Хонга та Землею.,
Sonna_BuildingResearched_RadarStation,line:70a6bf,"Сонна: І ми виявили, що це активно передає та отримує сигнали із Землі.",
Sonna_BuildingResearched_RadarStation,line:6b9870,Сонна: Я не можу не скласти шматки.,
Sonna_BuildingResearched_RadarStation,line:2cb4ac,"Сонна: Ця активна будівля зв'язку та напади, які ми зазнали ...",
Sonna_BuildingResearched_RadarStation,line:34513f,"Сонна: Я починаю вірити, що Теккі стоїть за цим.Можливо, вони стоять за цим дітям Карміна.",
Sonna_BuildingResearched_RadarStation,line:aef66c,Сонна: Наші технічні працівники командували своєю радіолокаційною системою і використовували її для підвищення власного наземного прийому сигналу.,
