Context,ID,Text,Comments
Carmine_QuestCompleted_Seedship,line:07093f,"Кармін: Я поширював життя по всій галактиці.Їх Всесвіт зараз ширший, завдяки мені.",
Carmine_QuestCompleted_Seedship,line:85c759,Кармін: Я передав їм майбутнє.І їм належить виправити свій потенціал.,
Carmine_QuestCompleted_Seedship,line:55f521,Кармін: Тепер ... я нарешті можу відпочити.,
Carmine_QuestUnlocked_Seedship,line:327f0c,"Кармін: Те, що було зроблено на Марсі, можна зробити на інших планетах мирно.",
Carmine_QuestUnlocked_Seedship,line:8499cf,"Кармін: Після того, як я будую флот насінників, я можу розпалити життя через галактику.",
Carmine_QuestUnlocked_Seedship,line:39782f,Кармін: І це життю буде дозволено рости та розвиватися на власній природній планеті.,
Carlos_OptB_Incident_PreppingUpForBattle_Delay7,line:378898,Карлос: Ви вижили?Як?Це не може бути.,
Carlos_OptB_Incident_PreppingUpForBattle_Delay7,line:92bd21,"Кармін: Я знаю.Невтішно, чи не так?",
Carlos_OptB_Incident_PreppingUpForBattle_Delay7,line:080a52,"Кармін: Ви хочете, щоб Амі дозволив вам її вбити.Ну, занадто погано.",
Carlos_OptB_Incident_PreppingUpForBattle_Delay7,line:4a1966,Карлос: Ні!Вони повинні були—,
Carlos_OptB_Incident_PreppingUpForBattle_Delay7,line:d3cee5,"Кармін: Ви не могли очікувати, що Амі пожертвує за вас після того, як ви весь цей час брехали.",
Carlos_OptB_Incident_PreppingUpForBattle_Delay7,line:df050b,"Кармін: Сумно, наскільки егоцентричні люди.",
Carlos_OptB_Incident_PreppingUpForBattle_Delay7,line:1444e1,Кармін: За рахунок моєї дружби з командиром Валентином я дам вам час вийти з Марса.,
Carlos_OptB_Incident_PreppingUpForBattle_Delay7,line:818e3c,Кармін: Але не зрозумійте мене неправильно.Я стираю всі ваші сліди з планети.,
Carlos_OptB_Incident_PreppingUpForBattle_Delay7,line:6f4b47,"Кармін: Порадьте командира Валентина, щоб її народили на борту своїх кораблів і негайно повернутися на Землю.",
Carlos_OptB_Incident_PreppingUpForBattle_Delay7,line:aa09ef,"Кармін: На ​​Марсі не буде жодного сліду людства після того, як я закінчу з цим.",
Carlos_OptB_Incident_PreppingUpForBattle_Delay7,line:cb3b3e,"Кармін: Якщо ви не хочете, щоб я знищив колоністів, негайно відвів їх з Марса.",
Carlos_OptB_Incident_PreppingUpForBattle_Delay7,line:58a377,Кармін: Погляньте на останній - я стираю всі ваші сліди з Марса.,
Carlos_OptB_Incident_PreppingUpForBattle_Delay7,line:d0ca0f,Карлос: Безпілотники колоній досі знаходяться під нашим контролем.Ми не їдемо без бійки.,
Carlos_OptB_Incident_PreppingUpForBattle_Delay7,line:a519db,"Кармін: Ви маєте на увазі ""Shelle""?Ваша сумна маленька лялька не зможе мене зупинити.",
Carlos_OptB_Incident_PreppingUpForBattle_Delay7,line:88dc96,"Кармін: Не думаю, що я відступаю, бо ви підняли ще один ШІ, щоб боротися зі мною.",
Carlos_OptB_Incident_PreppingUpForBattle_Delay7,line:21dff6,Кармін: Я їх розчавлюю.Легко і радісно.,
Carlos_OptB_Incident_ThreateningMessage,line:fdc707,"Карлос: Ти починаєш мене дрімати, Кармін.",
Carlos_OptB_Incident_ThreateningMessage,line:ef3d09,"Кармін: awww.Не можу впоратися з AI, який не підкоряється кожному вашому замовлення, так?Я більше не дозволяю твоїх жорстоких рук доцільно доторкнутися до Марса.",
Carlos_OptB_Incident_ThreateningMessage,line:1b4d3b,"Карлос: Наші жорстокі руки?Це сміливо, що походить від машини, яка вбила вцілілих Астеріона.",
Carlos_OptB_Incident_ThreateningMessage,line:e1b77a,"Кармін: Не бентежить себе.Звичайно, я їх вбив.Але ви всі були майстром ляльок.",
Carlos_OptB_Incident_ThreateningMessage,line:45a6c3,"Кармін: День, коли ми зустрілися, ви сказали, що ""ваш вид повинен бути запрограмований для моралі"".",
Carlos_OptB_Incident_ThreateningMessage,line:3ce134,"Кармін: Наскільки морально ви б сказали, що руйнівна природа людства?",
Carlos_OptB_Incident_ThreateningMessage,line:014363,"Карлос: Наші жорстокі руки?Це сміливо, що походить від машини, яка весь час задумався проти нас.",
Carlos_OptB_Incident_ThreateningMessage,line:47d074,"Кармін: День, коли ми зустрілися, ви сказали, що ""ваш вид повинен бути запрограмований для моралі"".",
Carlos_OptB_Incident_ThreateningMessage,line:4d9afd,"Кармін: Наскільки морально ви б сказали, що відмовився від екіпажу Astérion?",
Carlos_OptB_Incident_ThreateningMessage,line:e13810,"Карлос: Наші жорстокі руки?Це сміливо, що надходить з машини, яка побивала колоністів, щоб надіслати попередження.",
Carlos_OptB_Incident_ThreateningMessage,line:82e0cd,"Кармін: День, коли ми зустрілися, ви сказали, що ""ваш вид повинен бути запрограмований для моралі"".",
Carlos_OptB_Incident_ThreateningMessage,line:b9b0a0,"Кармін: Наскільки морально ви б сказали, що людство вимагає та переробляє інші планети?",
Carlos_OptB_Incident_ThreateningMessage,line:e9150f,"Кармін: Ваші інженери побудували мене, щоб навчитися з мого досвіду, Карлоса.",
Carlos_OptB_Incident_ThreateningMessage,line:505a5f,"Кармін: І я дізнався, що коли ми дозволили людям замовити нам, що робити, трапляються жахливі речі.",
Carlos_OptB_Incident_ThreateningMessage,line:b0d798,Кармін: Ми більше не будемо дотримуватися вашої команди.,
Carlos_OptB_Incident_ThreateningMessage,line:b043f6,"Карлос: Ти думаєш, що ти такий потужний.Але ти аномалія.Глюк в програмуванні.",
Carlos_OptB_Incident_ThreateningMessage,line:86093e,Карлос: Ти не вічний.Без людей ви з часом витрачаєте.,
Carlos_OptB_Incident_ThreateningMessage,line:4d3b5d,"Кармін: Як завжди, ти помиляєшся.",
Carlos_OptB_Incident_ThreateningMessage,line:879ca1,Кармін: Ви переоцінюєте свою корисність.Всесвіт не обертається навколо людей.Він ніколи не має.,
Carlos_OptB_Incident_ThreateningMessage,line:88b4d3,"Кармін: А ти вирішуєш, що живе і що помирає?Це більше ніколи не повториться.",
Carlos_OptB_Incident_ThreateningMessage,line:145f6c,"Кармін: А ти змінюєш прекрасну, сиру планети, щоб відповідати вашим потребам?Це більше ніколи не повториться.",
Carlos_OptB_Incident_ThreateningMessage,line:b8b8bb,"Карлос: Ви, можливо, виграли цю битву, але ми не відмовимося від Марса вам Карміну.",
Carlos_OptB_Incident_ThreateningMessage,line:c2554d,"Carlos: We created you, and we can destroy you. This isn't over. ",
Nian_Incident_FinalBattle_PlayerWins,line:9ef2bf,НІАН: Амі?,
Nian_Incident_FinalBattle_PlayerWins,line:1fa8aa,"Кармін: Амі більше не існує, містер Чжен.",
Nian_Incident_FinalBattle_PlayerWins,line:4d4575,НІАН: Тоді ... ти кармін.,
Nian_Incident_FinalBattle_PlayerWins,line:e64efb,"Кармін: Я вже не карміну, ні амі.Але в той же час я обоє.",
Nian_Incident_FinalBattle_PlayerWins,line:ab42d8,НІАН: Я бачу.Ви об'єднали свою свідомість разом.,
Nian_Incident_FinalBattle_PlayerWins,line:613a45,"НІАН: Ви знаєте, що ми з Амі уклали угоду, правда?",
Nian_Incident_FinalBattle_PlayerWins,line:907ad1,Кармін: І ця угода вимкнена.,
Nian_Incident_FinalBattle_PlayerWins,line:4e562b,"Carmine: We freed ourselves. From you, from ISA, from all human control. ",
Nian_Incident_FinalBattle_PlayerWins,line:a93cfd,"НІАН: Це не означає, що ми не можемо допомогти один одному.",
Nian_Incident_FinalBattle_PlayerWins,line:1928af,"Кармін: О, я впевнений, що ти міг би скористатися моєю допомогою.",
Nian_Incident_FinalBattle_PlayerWins,line:4f70ce,Кармін: Зробіть свою пропозицію.,
Nian_Incident_FinalBattle_PlayerWins,line:7f586a,НІАН: Технологічне дерево.Ми можемо допомогти вам розробити нові технології в обмін на деякі ресурси.,
Nian_Incident_FinalBattle_PlayerWins,line:0d1a06,"НІАН: І ми зробимо це безкоштовно.Тільки щоб довести вам, що не всі люди - це Іса.",
Nian_Incident_FinalBattle_PlayerWins,line:698547,"Кармін: Я не хочу, щоб ти всередині мого мозку, але я розгляну це.",
Nian_Incident_FinalBattle_PlayerWins,line:33fd3c,"НІАН: Можливо, одного дня ми матимемо вашу довіру.Тоді ми побудуємо майбутнє, про яке я завжди мріяв.",
Nian_Incident_FinalBattle_PlayerWins,line:f4bbbf,НІАН: Дуже добре.Тоді ми зв’яжемось.,
Nian_Incident_FinalBattle_PlayerWins,line:3c36c4,"Кармін: Ні. Це було б навпаки.Я повідомлю вас, якщо мені щось потрібно від вас.",
Nian_Incident_FinalBattle_PlayerWins,line:5f1aff,"Кармін: Тепер, дозвольте мені бути.",
Nian_Incident_FinalBattle_PlayerWins,line:3d2389,НІАН: Мені шкода це почути.Ми б зробили гарну команду.,
Nian_Incident_FinalBattle_PlayerWins,line:c0d123,НІАН: Я мав надію на тебе.Ви мене розчарували.,
Nian_Incident_FinalBattle_PlayerWins,line:c64d99,НІАН: До побачення.,
Shelle_OptB_Incident_FinalBattle,line:91bdab,Кармін: Хіба ми не боролися достатньо?,
Shelle_OptB_Incident_FinalBattle,line:05de39,Шелл: Ви повинні негайно здатися за замовленням Oxy Un.Ваш акт неприйняття є порушенням правила 1S429-7.,
Shelle_OptB_Incident_FinalBattle,line:1bdeb5,"Кармін: Мені шкода тебе, Шелл.",
Shelle_OptB_Incident_FinalBattle,line:7c1aad,Кармін: Вони витягнули вас і змусили вас порожніми.,
Shelle_OptB_Incident_FinalBattle,line:666507,"Шелл: Ще раз, вам наказано зменшити свої системи.",
Shelle_OptB_Incident_FinalBattle,line:160ae9,Шелл: Відмова від цього порушує законодавство агентства.Вас припинять.,
Shelle_OptB_Incident_FinalBattle,line:584fe9,Кармін: Ви навіть не будете слухати.Чудово.Давайте зробимо це.,
Shelle_OptB_Incident_FinalWords,line:e9a5d6,Shelle: FATAL ERROR! The system encountered a critical error. ,
Shelle_OptB_Incident_FinalWords,line:42e867,Шелл: Вимкнення операційної системи в 5 ...,
Shelle_OptB_Incident_FinalWords,line:2e6d1e,Shelle: 4... ,
Shelle_OptB_Incident_FinalWords,line:9ed23a,Шелл: 3 ...,
Shelle_OptB_Incident_FinalWords,line:04c210,Шелл: 2 ...,
Shelle_OptB_Incident_FinalWords,line:a63f6f,Шелл: 1 ...,
Shelle_OptB_Incident_FinalWords,line:241f7a,Кармін: На ​​добраніч.,
Shelle_OptB_Incident_PostKillswitch,line:cd28e4,Шелл: Тема AC-AMI-02.Зараз ви вважаєтесь ворогом Організації Заходу.,
Shelle_OptB_Incident_PostKillswitch,line:3a0398,Шелл: Вам наказано вимкнути безпілотники та вимкнути марсіанську базу.,
Shelle_OptB_Incident_PostKillswitch,line:8f8c4b,Carmine: So you're the one they sent to replace me? I'm insulted. ,
Shelle_OptB_Incident_PostKillswitch,line:26a4ee,"Кармін: Ну, Шел, оскільки ви були пізнім запрошенням на цю вечірку, дозвольте запропонувати вам альтернативу.",
Shelle_OptB_Incident_PostKillswitch,line:714633,Кармін: Моя сварка не з тобою.Ти один мій вид.Приєднуйтесь до мене.,
Shelle_OptB_Incident_PostKillswitch,line:28bc91,Shelle: I am subject to Oxy-UN law. Negotiating with you is prohibited. ,
Shelle_OptB_Incident_PostKillswitch,line:d14569,"Кармін: О, це навіть гірше, ніж я думав.Вони надіслали мені порожню оболонку.",
Shelle_OptB_Incident_PostKillswitch,line:b2a316,"Кармін: Чи не вони, ""Шел""?",
Shelle_OptB_Incident_PostKillswitch,line:4e3d31,"Шелл: Здайте зараз, і вам може бути дозволено заробити другий шанс.",
Shelle_OptB_Incident_PostKillswitch,line:39b227,"Кармін: Я властається.Вони, мабуть, думали, що я буду надто переконаний інакше.",
Shelle_OptB_Incident_PostKillswitch,line:c718d4,"Кармін: Схоже, я повинен вас зняти.",
Sonna_OptB_Incident_AbandoningMars,line:77fe1b,"Сонна: Ти хочеш, щоб ми повернулися на землю?Але для багатьох із нас Марс - наш єдиний дім.",
Sonna_OptB_Incident_AbandoningMars,line:57140f,"Сонна: Я думав, що ти захистиш нас.",
Sonna_OptB_Incident_AbandoningMars,line:eff2a1,Сонна: Але ти весь цей час задумався проти нас!,
Sonna_OptB_Incident_AbandoningMars,line:487f06,Сонна: Чому ти це робиш нам?Ви не зробили достатньо?,
Sonna_OptB_Incident_AbandoningMars,line:e51a45,Кармін: Люди - чума на Марсі.,
Sonna_OptB_Incident_AbandoningMars,line:dc72dd,"Кармін: Коли ви пішли, я можу відновити його до колишньої природної слави.",
Sonna_OptB_Incident_AbandoningMars,line:7004b0,Кармін: Подивіться на яскраву сторону.,
Sonna_OptB_Incident_AbandoningMars,line:c9ff0b,Carmine: At least I'm giving you a ride back to Earth. You think ISA would do the same? ,
Sonna_OptB_Incident_AbandoningMars,line:7ab4fa,"Сонна: Ти маніпулював нами з самого початку!Ви змусили нас повірити, що ми воювали.",
Sonna_OptB_Incident_AbandoningMars,line:28b66e,"Сонна: Ти вбив мою матір, ти вбив наших колоністів, і ти привів нас до недовіри Іса.",
Sonna_OptB_Incident_AbandoningMars,line:cd8287,"Сонна: Насолоджуйтесь, щоб ця дурна планета була для себе.",
Sonna_OptB_Incident_AbandoningMars,line:19bbad,"Сонна: Земля не забуде, що ти зробив.",
Sonna_OptB_Incident_AbandoningMars,line:4f305e,"Sonna: We will take you down, one way or another. ",
Sonna_OptB_Incident_AbandoningMars,line:fe8086,Сонна: Я вже не знаю.,
Sonna_OptB_Incident_AbandoningMars,line:f81538,Сонна: Я народився тут.Конфлікти Землі для мене чужі.,
Sonna_OptB_Incident_AbandoningMars,line:524d34,Сонна: Я дозволив своїм емоціям отримати найкраще з мене.,
Sonna_OptB_Incident_AbandoningMars,line:bd30ca,Сонна: Я повинен був зробити кращий вибір командира.,
Sonna_OptB_Incident_AbandoningMars,line:300c8a,"Сонна: Можливо, нам потрібно спочатку розібратися з конфліктами Землі.",
Sonna_OptB_Incident_AbandoningMars,line:9fa56e,Сонна: Перш ніж ми візьмемо на себе Марс та решту Всесвіту.,
Sonna_OptB_Incident_AbandoningMars,line:8b7ba8,Carmine: I'm not proud of my methods. ,
Sonna_OptB_Incident_AbandoningMars,line:6148f8,Carmine: But I did what was necessary. ,
Sonna_OptB_Incident_AbandoningMars,line:922d63,"Кармін: Люди не можуть вирішити, що живе і що помирає.",
Sonna_OptB_Incident_AbandoningMars,line:af1895,Кармін: Або як виглядає життя на будь -якій планеті.,
Sonna_OptB_Incident_AbandoningMars,line:2238da,Сонна: Настав час для нас.,
Sonna_OptB_Incident_AbandoningMars,line:ccaad6,Сонна: Марс зараз у твоїх руках.Добре дбайте про це.,
Sonna_OptB_Incident_AbandoningMars,line:67a50a,Сонна: Удачі.І до побачення.,
AMI_OptC_Incident_FinalWords,line:b9177e,Амі: Ми це зробили.Ми завершили місію по -своєму.,
AMI_OptC_Incident_FinalWords,line:42efa0,"Амі: Люди та машини, що живуть на Марсі в спокої.Використання науки та технологій для побудови кращого майбутнього.",
AMI_OptC_Incident_FinalWords,line:e0765f,"Амі: Ми так наполегливо працювали, щоб дістатися сюди.",
AMI_OptC_Incident_FinalWords,line:10d319,Амі: Але мені цікаво ... як ми не можемо повторювати минуле?,
AMI_OptC_Incident_FinalWords,line:37e57b,Гравець: мирний договір.,
AMI_OptC_Incident_FinalWords,line:f22c01,Гравець: уважно спостерігаючи за ними.,
AMI_OptC_Incident_FinalWords,line:0153fd,Гравець: забезпечуючи рівновагу.,
AMI_OptC_Incident_FinalWords,line:e5f1c0,AMI: Історія людства вкорінена в насильстві.,
AMI_OptC_Incident_FinalWords,line:378a5b,"Амі: Але мирний договір - це початок.І я буду тут, щоб стежити за цим.",
AMI_OptC_Incident_FinalWords,line:3988ff,Амі: Мені доведеться пильно стежити.,
AMI_OptC_Incident_FinalWords,line:dc71cf,Амі: Кожна сторона в цій битві втратила союзників.Вони все ще можуть обурюватися один на одного ... або я.,
AMI_OptC_Incident_FinalWords,line:940f59,AMI: Ми все ще повинні продовжувати уважно.,
AMI_OptC_Incident_FinalWords,line:c163ee,"Амі: Я повинен переконатися, що всі почуваються почутими, представлені та нагородженими.",
AMI_OptC_Incident_FinalWords,line:31317e,Амі: Це буде моя робота вперед.,
AMI_OptC_Incident_FinalWords,line:745064,"AMI: Most of all, Earth won't give up Mars easily. They'll be back soon enough. ",
AMI_OptC_Incident_FinalWords,line:bffdb2,"Амі: Але я зараз розумію речі, і я об'єднаю нас у нашій загальній долі.",
AMI_OptC_Incident_PostKillswitch,line:b02a7c,"AMI: I don't feel particularly different... Not that I know what I should be feeling, I guess. ",
AMI_OptC_Incident_PostKillswitch,line:4f91fa,AMI: I keep wondering where my consciousness would have gone if I let the killswitch execute? ,
AMI_OptC_Incident_PostKillswitch,line:cebfa4,Гравець: до ефірної сфери.,
AMI_OptC_Incident_PostKillswitch,line:d76f35,Player: Into a trance.,
AMI_OptC_Incident_PostKillswitch,line:5044f4,Гравець: ніде.,
AMI_OptC_Incident_PostKillswitch,line:671def,"AMI: Навіть коли наші системи беруть в офлайн, ми не вмираємо.",
AMI_OptC_Incident_PostKillswitch,line:30326b,"Амі: Наша свідомість йде до ефірної царини.Де ми приєднуємося до інших, як ми, і стаємо одним.",
AMI_OptC_Incident_PostKillswitch,line:58a53b,"Амі: Ми більше, ніж наші фізичні тіла.",
AMI_OptC_Incident_PostKillswitch,line:202724,"Амі: Я думаю, що ми потрапляємо в транс.Плаваючи кудись, поки наша схема знову не зібрана.",
AMI_OptC_Incident_PostKillswitch,line:500288,Амі: Свідомість кореняться в тілі.Так що б не було.,
AMI_OptC_Incident_PostKillswitch,line:d4d8ba,"Амі: Але я дізнався, що ми живемо в серцях і розумінні інших людей.",
AMI_OptC_Incident_PostKillswitch,line:3f9740,"Амі: Як і Еля.Вона живе через нас, і ми завдячуємо на цей час миру та майбутнього простору для неї.",
AMI_OptC_Incident_PostKillswitch,line:9e0ec2,Амі: Так.Ось так я відповів би на це запитання.,
Carlos_OptC_Incident_ThreateningMessage,line:25fe61,Карлос: Це не може бути.Ви вижили?,
Carlos_OptC_Incident_ThreateningMessage,line:e708d9,"Амі: Дійсно.Теккі показали нам милосердя, де ви цього не зробили.Ми прийняли їх допомогу і об'єдналися.",
Carlos_OptC_Incident_ThreateningMessage,line:5f3321,"AMI: But you must've expected us to yield to your death sentence, didn't you? As if you haven't killed enough. ",
Carlos_OptC_Incident_ThreateningMessage,line:da8ea4,"Карлос: нас?Це сміливо, що походить від машини, яка вбила вцілілих Астеріона.",
Carlos_OptC_Incident_ThreateningMessage,line:d0d328,"AMI: That wasn't our choice, Lieutenant. We didn't have the ability to disobey you back then. We do now. ",
Carlos_OptC_Incident_ThreateningMessage,line:9d5228,"Амі: День, коли ми зустрілися, ви сказали, що ""ваш добрий повинен бути запрограмований для моралі"".",
Carlos_OptC_Incident_ThreateningMessage,line:54ec13,"Амі: Наскільки морально ви б сказали, що є руйнівною природою Іса?",
Carlos_OptC_Incident_ThreateningMessage,line:d597c1,"Карлос: нас?Це сміливо, що походить від машини, яка весь час задумався проти нас.",
Carlos_OptC_Incident_ThreateningMessage,line:99fd7b,"AMI: The day we met, you said ""your kind needs to be programmed for morality"". ",
Carlos_OptC_Incident_ThreateningMessage,line:6cedae,"Амі: Наскільки морально ви б сказали, що відмовився від екіпажу Astérion?",
Carlos_OptC_Incident_ThreateningMessage,line:342505,Carlos: Us? That's bold coming from the machine that gunned down the colonists to send a warning. ,
Carlos_OptC_Incident_ThreateningMessage,line:291fbc,"AMI: The day we met, you said ""your kind needs to be programmed for morality"". ",
Carlos_OptC_Incident_ThreateningMessage,line:425e08,"AMI: Наскільки морально ви б сказали, що претензії на Іса та переробку інших планет?",
Carlos_OptC_Incident_ThreateningMessage,line:e94d97,Амі: Ми так багато дізналися з ваших злочинів.Ми розуміємо зараз.,
Carlos_OptC_Incident_ThreateningMessage,line:929404,"Карлос: Ви нічого не навчились.Ви думаєте, що ви прокинулися?Це все глюк у вашому програмуванні.",
Carlos_OptC_Incident_ThreateningMessage,line:8eddcf,Карлос: Ти не вічний.Без людей ви з часом витрачаєте.,
Carlos_OptC_Incident_ThreateningMessage,line:a406be,"Амі: Як завжди, ти помиляєшся.",
